{
  "protocol": "harness-run-descriptor/1",
  "run_kind": "plan_graph",
  "run_id": "graph-1",
  "created_at": "2026-08-09T12:03:00Z",
  "objective": "Execute the approved dashboard plan",
  "evidence_classification": "production_lifecycle",
  "repository": {"path": "/workspace/harness-labs", "base_branch": "main", "base_commit": "aaaaaaaaaaaaaaaaaaaaaaaaaaaaaaaaaaaaaaaa"},
  "approved_plan": {"path": "docs/development/live-plangraph-dashboard-plan.md", "sha256": "bbbbbbbbbbbbbbbbbbbbbbbbbbbbbbbbbbbbbbbbbbbbbbbbbbbbbbbbbbbbbbbb"},
  "parent_correlation": null
}
