{
  "protocol": "harness-run-descriptor/1",
  "run_kind": "feature_run",
  "run_id": "feature-active-1",
  "created_at": "2026-08-09T12:01:00Z",
  "objective": "Build the read model",
  "evidence_classification": "production_lifecycle",
  "repository": {"path": "/workspace/harness-labs", "base_branch": "main", "base_commit": "aaaaaaaaaaaaaaaaaaaaaaaaaaaaaaaaaaaaaaaa"},
  "approved_plan": {"path": "docs/development/live-plangraph-dashboard-plan.md", "sha256": "bbbbbbbbbbbbbbbbbbbbbbbbbbbbbbbbbbbbbbbbbbbbbbbbbbbbbbbbbbbbbbbb"},
  "parent_correlation": null
}
