{
  "protocol": "harness-run-descriptor/1",
  "run_kind": "feature_run",
  "run_id": "feature-child-1",
  "created_at": "2026-08-09T12:04:00Z",
  "objective": "Define catalog contracts",
  "evidence_classification": "production_lifecycle",
  "repository": {"path": "/workspace/harness-labs", "base_branch": "main", "base_commit": "aaaaaaaaaaaaaaaaaaaaaaaaaaaaaaaaaaaaaaaa"},
  "approved_plan": {"path": "docs/development/live-plangraph-dashboard-plan.md", "sha256": "bbbbbbbbbbbbbbbbbbbbbbbbbbbbbbbbbbbbbbbbbbbbbbbbbbbbbbbbbbbbbbbb"},
  "parent_correlation": {"plan_graph_id": "graph-1", "plan_node_id": "catalog-contracts", "parent_run_id": "graph-1"}
}
